{
  "schemaVersion": "record/1",
  "id": "nrhp:pt:1418942",
  "collection": "nrhp-listed",
  "layer": "historic",
  "name": "NRHP 82004525 · building",
  "nameRule": "label-by-id",
  "kind": "building",
  "geometry": {
    "type": "Point",
    "coordinates": [
      -97.71168835699996,
      30.26366033100004
    ]
  },
  "place": {
    "stateFips": "48",
    "stateUsps": "TX",
    "method": "name-lookup"
  },
  "details": {
    "resource type": "building",
    "listed": "1982-06",
    "city": "Austin",
    "county": "Travis",
    "state": "TEXAS",
    "nris refnum": "82004525",
    "nomination (National Archives)": "https://catalog.archives.gov/id/40973809",
    "drawn": "NPS's point for the listing",
    "what this is": "a property listed on the National Register of Historic Places, as NPS's public spatial data shows it",
    "not shown": "archaeological sites whose locations are restricted under NHPA section 304 / ARPA; absence here is not absence on the ground"
  },
  "text": "collection: National Register of Historic Places; agency: National Park Service; city: Austin; county: Travis; state: TEXAS; historic resource type: building; listed on the National Register: 1982-06",
  "provenance": {
    "sourceId": "nps-nrhp",
    "sourceName": "National Register of Historic Places spatial data (public, non-restricted listings; nrhp_locations MapServer)",
    "publisher": "National Park Service, Cultural Resources GIS",
    "licence": "US federal (public domain); general reference only, not Section 106 compliance; NPS publishes only non-sensitive, non-restricted listings",
    "seriesId": "nrhp_locations MapServer layer 0 (points), listed, restricted addresses excluded",
    "upstreamUrl": "https://mapservices.nps.gov/arcgis/rest/services/cultural_resources/nrhp_locations/MapServer/0",
    "retrievedAt": "2026-10-18T22:35:04.454Z",
    "kind": "published",
    "notes": [
      "bbox -97.72,30.26,-97.7,30.28"
    ]
  },
  "snapshotId": "nrhp-listed.austin-east.2026-10-18"
}
