{
  "schemaVersion": "record/1",
  "id": "nces:480001609410",
  "collection": "nces-public-schools",
  "layer": "schools",
  "name": "TEXANS CAN ACADEMY - AUSTIN",
  "nameRule": "public-name",
  "kind": "high",
  "geometry": {
    "type": "Point",
    "coordinates": [
      -97.70894599978494,
      30.272212999729046
    ]
  },
  "place": {
    "stateFips": "48",
    "stateUsps": "TX",
    "countyFips": "48453",
    "method": "source-field"
  },
  "details": {
    "NCES school id": "480001609410",
    "district": "TEXANS CAN ACADEMIES",
    "grades": "09 to 12",
    "level": "High",
    "type": "Alternative Education School",
    "charter": "Yes",
    "virtual": "not reported",
    "status": "Open",
    "locale": "11-City: Large",
    "enrollment": "168",
    "free or reduced-price lunch": "69.6 % (117 of 168)",
    "students per FTE teacher": "21.2",
    "FTE teachers": "7.9",
    "address": "2406 ROSEWOOD AVE, AUSTIN, TX 78702",
    "county": "Travis County (48453)",
    "NCES page": "https://nces.ed.gov/ccd/schoolsearch/school_detail.asp?ID=480001609410"
  },
  "text": "collection: Public schools; agency: National Center for Education Statistics (NCES); name: TEXANS CAN ACADEMY - AUSTIN; city: AUSTIN; county: Travis County; state: TX; school level: High; school type: Alternative Education School; charter school: Yes; virtual school status: not reported; school status: Open; locale: 11-City: Large; lowest grade: 09; highest grade: 12",
  "provenance": {
    "sourceId": "nces-edge-public",
    "sourceName": "Public School Administrative Data 2024-25 (EDGE_ADMINDATA_PUBLICSCH_2425 MapServer layer 1)",
    "publisher": "U.S. Department of Education, National Center for Education Statistics, Education Demographic and Geographic Estimates (EDGE) program",
    "licence": "US federal (public domain); credit: U.S. Department of Education, National Center for Education Statistics, EDGE / Common Core of Data, school year 2024-25",
    "seriesId": "EDGE_ADMINDATA_PUBLICSCH_2425 MapServer layer 1 (Public School Administrative Data 2024-25)",
    "upstreamUrl": "https://nces.ed.gov/opengis/rest/services/K12_School_Locations/EDGE_ADMINDATA_PUBLICSCH_2425/MapServer/1",
    "period": "school year 2024-25",
    "retrievedAt": "2026-10-18T22:35:03.591Z",
    "kind": "published",
    "notes": [
      "bbox -97.75,30.25,-97.7,30.3"
    ]
  },
  "snapshotId": "nces-public-schools.austin-east.2026-10-18"
}
