{
  "schemaVersion": "record/1",
  "id": "nces:480147313991",
  "collection": "nces-public-schools",
  "layer": "schools",
  "name": "UNIVERSITY OF TEXAS AT AUSTIN H S",
  "nameRule": "public-name",
  "kind": "high",
  "geometry": {
    "type": "Point",
    "coordinates": [
      -97.74288499957372,
      30.27935599990067
    ]
  },
  "place": {
    "stateFips": "48",
    "stateUsps": "TX",
    "countyFips": "48453",
    "method": "source-field"
  },
  "details": {
    "NCES school id": "480147313991",
    "district": "UNIVERSITY OF TEXAS AT AUSTIN H S",
    "grades": "09 to 12",
    "level": "High",
    "type": "Regular School",
    "charter": "No",
    "virtual": "Full Virtual",
    "status": "Open",
    "locale": "11-City: Large",
    "enrollment": "1,056",
    "free or reduced-price lunch": "28.8 % (304 of 1,056)",
    "students per FTE teacher": "37.6",
    "FTE teachers": "28.1",
    "address": "2901 N IH-35, AUSTIN, TX 78722",
    "county": "Travis County (48453)",
    "NCES page": "https://nces.ed.gov/ccd/schoolsearch/school_detail.asp?ID=480147313991",
    "what the point is": "a full virtual school's administrative address, not where students are"
  },
  "text": "collection: Public schools; agency: National Center for Education Statistics (NCES); name: UNIVERSITY OF TEXAS AT AUSTIN H S; city: AUSTIN; county: Travis County; state: TX; school level: High; school type: Regular School; charter school: No; virtual school status: Full Virtual; school status: Open; locale: 11-City: Large; lowest grade: 09; highest grade: 12",
  "provenance": {
    "sourceId": "nces-edge-public",
    "sourceName": "Public School Administrative Data 2024-25 (EDGE_ADMINDATA_PUBLICSCH_2425 MapServer layer 1)",
    "publisher": "U.S. Department of Education, National Center for Education Statistics, Education Demographic and Geographic Estimates (EDGE) program",
    "licence": "US federal (public domain); credit: U.S. Department of Education, National Center for Education Statistics, EDGE / Common Core of Data, school year 2024-25",
    "seriesId": "EDGE_ADMINDATA_PUBLICSCH_2425 MapServer layer 1 (Public School Administrative Data 2024-25)",
    "upstreamUrl": "https://nces.ed.gov/opengis/rest/services/K12_School_Locations/EDGE_ADMINDATA_PUBLICSCH_2425/MapServer/1",
    "period": "school year 2024-25",
    "retrievedAt": "2026-10-18T22:35:03.591Z",
    "kind": "published",
    "notes": [
      "bbox -97.75,30.25,-97.7,30.3"
    ]
  },
  "snapshotId": "nces-public-schools.austin-downtown.2026-10-18"
}
